{"run_id":"r_fixturewh0001","kind":"ask","q":"When did the worker start to dodge the forklift, and how far was it?","context":{"workspace":"warehouse","scene_key":"wh-sdg-fixture-01"},"status":"done","final":"SUPPORTED","created":"2026-10-09T00:00:00Z","elapsed_ms":95,"source_run_id":null,"weave_url":null,"model_revs":{"vlm":"cosmos3-nano-reasoner@fixture"},"steps":[{"step_id":"r_fixturewh0001.s0","parent_step_id":null,"i":0,"state":"parse","name":"parse","started_ms":4,"elapsed_ms":5,"input":{"summary":"Template find: worker, forklift; action dodge"},"output":null,"evidence_ids":[],"note":"Template find: worker, forklift; action dodge","exec_state":"live","weave_call_id":null,"trace_delivery_state":"local","blob_ref":null},{"step_id":"r_fixturewh0001.s1","parent_step_id":null,"i":1,"state":"retrieve","name":"retrieve","started_ms":30,"elapsed_ms":5,"input":{"summary":"Hard-filter preselection → text and visual top-50 each → RRF"},"output":null,"evidence_ids":[],"note":"Hard-filter preselection → text and visual top-50 each → RRF","exec_state":"live","weave_call_id":null,"trace_delivery_state":"local","blob_ref":null},{"step_id":"r_fixturewh0001.s2","parent_step_id":"r_fixturewh0001.s1","i":2,"state":"retrieve","name":"tool.search","started_ms":32,"elapsed_ms":12,"input":{"q":"The worker dodges the forklift","workspace":"warehouse"},"output":{"input_range":{"scene_key":"wh-sdg-fixture-01","cam_id":null,"t0_ms":0,"t1_ms":10000},"pts_read":6,"model_rev":null,"output":{"n_cards":1},"coverage":1.0,"gaps":[],"quality":"ok","elapsed_ms":12,"exec_state":"live","error":null},"evidence_ids":["e_a363d220af21b141","e_4a18f3e5e7eeb929"],"note":"Semantic retrieval of candidate moments","exec_state":"live","weave_call_id":null,"trace_delivery_state":"local","blob_ref":null},{"step_id":"r_fixturewh0001.s3","parent_step_id":null,"i":3,"state":"inspect","name":"assess","started_ms":60,"elapsed_ms":5,"input":{"summary":"Primary camera ceiling_00: the floor cell containing P1 is occluded"},"output":null,"evidence_ids":[],"note":"Primary camera ceiling_00: the floor cell containing P1 is occluded","exec_state":"live","weave_call_id":null,"trace_delivery_state":"local","blob_ref":null},{"step_id":"r_fixturewh0001.s4","parent_step_id":"r_fixturewh0001.s3","i":4,"state":"inspect","name":"tool.visibility","started_ms":62,"elapsed_ms":12,"input":{"scene_key":"wh-sdg-fixture-01","t_ms":4600,"target":"P1","cam":"ceiling_00"},"output":{"input_range":{"scene_key":"wh-sdg-fixture-01","cam_id":"ceiling_00","t0_ms":4000,"t1_ms":5000},"pts_read":1,"model_rev":null,"output":{"floor_cell":{"seen_by":["ceiling_04","eye_00"],"hidden_from":["ceiling_00"]}},"coverage":1.0,"gaps":[],"quality":"ok","elapsed_ms":12,"exec_state":"live","error":null},"evidence_ids":["e_1449f20a31b383ff"],"note":"Can the primary camera see the floor cell containing P1?","exec_state":"live","weave_call_id":null,"trace_delivery_state":"local","blob_ref":null},{"step_id":"r_fixturewh0001.s5","parent_step_id":null,"i":5,"state":"plan","name":"policy.plan_next","started_ms":70,"elapsed_ms":5,"input":{"summary":"Candidates: ceiling_04 gain 0.62 · eye_00 gain 0.41 → choose ceiling_04"},"output":null,"evidence_ids":[],"note":"Candidates: ceiling_04 gain 0.62 · eye_00 gain 0.41 → choose ceiling_04","exec_state":"live","weave_call_id":null,"trace_delivery_state":"local","blob_ref":null},{"step_id":"r_fixturewh0001.s6","parent_step_id":null,"i":6,"state":"measure","name":"assess","started_ms":80,"elapsed_ms":5,"input":{"summary":"ceiling_04 + eye_00 triangulated distance measurement"},"output":null,"evidence_ids":[],"note":"ceiling_04 + eye_00 triangulated distance measurement","exec_state":"live","weave_call_id":null,"trace_delivery_state":"local","blob_ref":null},{"step_id":"r_fixturewh0001.s7","parent_step_id":"r_fixturewh0001.s6","i":7,"state":"measure","name":"tool.measure","started_ms":84,"elapsed_ms":12,"input":{"scene_key":"wh-sdg-fixture-01","t_ms":4600,"a":{"scene_key":"wh-sdg-fixture-01","entity_id":"P1","kind":"person"},"b":{"scene_key":"wh-sdg-fixture-01","entity_id":"F1","kind":"forklift"},"kind":"distance"},"output":{"input_range":{"scene_key":"wh-sdg-fixture-01","cam_id":"ceiling_04","t0_ms":4600,"t1_ms":4700},"pts_read":1,"model_rev":null,"output":{"value":1.55,"sigma":0.12,"method":"ground_distance_tri"},"coverage":1.0,"gaps":[],"quality":"ok","elapsed_ms":12,"exec_state":"live","error":null},"evidence_ids":["e_5d60fc7e6ed93290"],"note":"Visible in the second camera; measure the P1–F1 ground distance","exec_state":"live","weave_call_id":null,"trace_delivery_state":"local","blob_ref":null},{"step_id":"r_fixturewh0001.s8","parent_step_id":null,"i":8,"state":"answer","name":"answer","started_ms":90,"elapsed_ms":5,"input":{"summary":"Template sentence + measurement interpolation"},"output":null,"evidence_ids":[],"note":"Template sentence + measurement interpolation","exec_state":"live","weave_call_id":null,"trace_delivery_state":"local","blob_ref":null}],"claims":[{"run_id":"r_fixturewh0001","claim_id":"c1","text":"The worker was less than 2 m from the forklift when dodging started","predicates":[{"predicate_id":"p1","subject_refs":[{"scene_key":"wh-sdg-fixture-01","entity_id":"P1","kind":"person"},{"scene_key":"wh-sdg-fixture-01","entity_id":"F1","kind":"forklift"}],"operator":"lt","value":2.0,"unit":"m","status":"supported","eids":["e_5d60fc7e6ed93290"]}],"aggregate":"SUPPORTED","before":"UNRESOLVED","after":"SUPPORTED","examined_eids":["e_a363d220af21b141","e_1449f20a31b383ff","e_5d60fc7e6ed93290"],"available_eids":[],"explain":{"c1":"c_0d6a1cd60734","c2":"c_520cb6616154"}}],"evidence":[{"eid":"e_a363d220af21b141","scene_key":"wh-sdg-fixture-01","cam_id":"ceiling_04","t0_ms":0,"t1_ms":5000,"observation_ids":[],"analysis_rev":"fx-0001","kind":"model","method":"caption_embed1_rrf","value":{"rank_text":1,"rank_visual":2,"rrf":0.0325},"unit":null,"sigma":null,"artifact_ref":null},{"eid":"e_4a18f3e5e7eeb929","scene_key":"wh-sdg-fixture-01","cam_id":null,"t0_ms":4600,"t1_ms":5600,"observation_ids":[{"scene_key":"wh-sdg-fixture-01","cam_id":"ceiling_04","local_track_id":7,"t_ms":4600}],"analysis_rev":"fx-0001","kind":"measure","method":"event_gt_dodge","value":{"event_id":"wh-sdg-fixture-01:E2","t0_ms":4600},"unit":null,"sigma":null,"artifact_ref":null},{"eid":"e_1449f20a31b383ff","scene_key":"wh-sdg-fixture-01","cam_id":"ceiling_00","t0_ms":4000,"t1_ms":5000,"observation_ids":[],"analysis_rev":"fx-0001","kind":"measure","method":"floor_cell_visibility","value":{"cell":[16,7],"state":"occluded"},"unit":null,"sigma":null,"artifact_ref":null},{"eid":"e_5d60fc7e6ed93290","scene_key":"wh-sdg-fixture-01","cam_id":"ceiling_04","t0_ms":4600,"t1_ms":4700,"observation_ids":[{"scene_key":"wh-sdg-fixture-01","cam_id":"ceiling_04","local_track_id":7,"t_ms":4600},{"scene_key":"wh-sdg-fixture-01","cam_id":"eye_00","local_track_id":11,"t_ms":4600},{"scene_key":"wh-sdg-fixture-01","cam_id":"ceiling_04","local_track_id":6,"t_ms":4600}],"analysis_rev":"fx-0001","kind":"measure","method":"ground_distance_tri","value":1.55,"unit":"m","sigma":0.12,"artifact_ref":null}],"hits":[{"moment_id":"m_wh-sdg-fixture-01_4600","scene_key":"wh-sdg-fixture-01","t0_ms":4600,"t1_ms":5600,"cams":["ceiling_00","ceiling_04","eye_00"],"primary_cam":"ceiling_00","actor_refs":[{"scene_key":"wh-sdg-fixture-01","entity_id":"P1","kind":"person"},{"scene_key":"wh-sdg-fixture-01","entity_id":"F1","kind":"forklift"}],"evidence_ids":["e_a363d220af21b141","e_4a18f3e5e7eeb929"],"score":0.0325,"why":["caption rank 1 · visual rank 2","Dodge event starts at 4.6 s"],"thumb":"/api/assets/wh-sdg-fixture-01/thumbs/ceiling_00/00004.jpg","exec_state":"live","backend":"duckdb","clip_id":"wh-sdg-fixture-01:ceiling_04:00000","vss_rank":null,"time_filter":null}]}
